{
  "schema_version": "1.0",
  "ledger_id": "photography_skill_exposure_ledger_v1",
  "created_at": "2026-07-29T10:27:00Z",
  "dataset": {
    "id": "photography-skill-v1",
    "version": "1.0.0",
    "content_hash": "sha256:9f1ab02a6f25b8b9f552b51ccd22b79a03f91f6b5f314fee70897b4df3bd6fb2"
  },
  "summary": {
    "asset_count": 60,
    "selected_exposed_count": 60,
    "provider_exposed_count": 30,
    "holdout_count": 12,
    "holdout_exposed_count": 12,
    "unseen_holdout_count": 0
  },
  "assets": [
    {
      "asset_id": "photo-v1-difficult-001",
      "dataset_split": "training",
      "source_url": "https://commons.wikimedia.org/wiki/File:Mount_Lushan_-_fog.JPG",
      "content_hash": "sha256:4366f55b907dd4e23da02b3c46826ab332cf1bb5bc9309fff497edda6aff14dd",
      "selected_exposed": true,
      "provider_exposed": false,
      "live_completed": false,
      "mock_seen": false,
      "potential_iteration_influence": false,
      "run_ids": [
        "run_live_qwen37plus_full60_beta_20260728_001",
        "run_live_qwen37plus_full60_beta_20260728_002",
        "run_live_qwen37plus_full60_beta_20260728_003",
        "run_live_qwen37plus_full60_beta_20260728_004",
        "run_live_qwen37plus_full60_beta_prompt15_20260728_012",
        "run_live_qwen37plus_full60_beta_prompt16_20260728_013"
      ],
      "prompt_versions": [
        "1.0.0",
        "1.5.0",
        "1.6.0"
      ],
      "first_seen_at": "2026-07-28T07:33:55.836Z",
      "last_seen_at": "2026-07-28T08:52:13.277Z",
      "unseen_eligible": false
    },
    {
      "asset_id": "photo-v1-difficult-002",
      "dataset_split": "training",
      "source_url": "https://commons.wikimedia.org/wiki/File:Trees_in_fog_on_the_northern_side_of_Loch_Tay,_Scottish_Highlands,_Scotland.jpg",
      "content_hash": "sha256:6725eb1e272cdb0b62ddd4a0610944b73a89200eba10249b5b32efd5799662c9",
      "selected_exposed": true,
      "provider_exposed": false,
      "live_completed": false,
      "mock_seen": false,
      "potential_iteration_influence": false,
      "run_ids": [
        "run_live_qwen37plus_full60_beta_20260728_001",
        "run_live_qwen37plus_full60_beta_20260728_002",
        "run_live_qwen37plus_full60_beta_20260728_003",
        "run_live_qwen37plus_full60_beta_20260728_004",
        "run_live_qwen37plus_full60_beta_prompt15_20260728_012",
        "run_live_qwen37plus_full60_beta_prompt16_20260728_013"
      ],
      "prompt_versions": [
        "1.0.0",
        "1.5.0",
        "1.6.0"
      ],
      "first_seen_at": "2026-07-28T07:33:55.836Z",
      "last_seen_at": "2026-07-28T08:52:13.277Z",
      "unseen_eligible": false
    },
    {
      "asset_id": "photo-v1-difficult-003",
      "dataset_split": "training",
      "source_url": "https://commons.wikimedia.org/wiki/File:Morning_fog_in_Upper_Silesia.jpg",
      "content_hash": "sha256:b3e2ac4db911bfdf094ee5582506e01a243ade6bcff58791d4bbb46b830e0280",
      "selected_exposed": true,
      "provider_exposed": false,
      "live_completed": false,
      "mock_seen": false,
      "potential_iteration_influence": false,
      "run_ids": [
        "run_live_qwen37plus_full60_beta_20260728_001",
        "run_live_qwen37plus_full60_beta_20260728_002",
        "run_live_qwen37plus_full60_beta_20260728_003",
        "run_live_qwen37plus_full60_beta_20260728_004",
        "run_live_qwen37plus_full60_beta_prompt15_20260728_012",
        "run_live_qwen37plus_full60_beta_prompt16_20260728_013"
      ],
      "prompt_versions": [
        "1.0.0",
        "1.5.0",
        "1.6.0"
      ],
      "first_seen_at": "2026-07-28T07:33:55.836Z",
      "last_seen_at": "2026-07-28T08:52:13.277Z",
      "unseen_eligible": false
    },
    {
      "asset_id": "photo-v1-difficult-004",
      "dataset_split": "training",
      "source_url": "https://commons.wikimedia.org/wiki/File:Man_at_Dundas_subway_station,_Toronto,_2008-05-06.jpg",
      "content_hash": "sha256:71f30bd573e7902f8d1e99293a04c0b29a4fdc804f7ad2ec990d9540506343ba",
      "selected_exposed": true,
      "provider_exposed": false,
      "live_completed": false,
      "mock_seen": false,
      "potential_iteration_influence": false,
      "run_ids": [
        "run_live_qwen37plus_full60_beta_20260728_001",
        "run_live_qwen37plus_full60_beta_20260728_002",
        "run_live_qwen37plus_full60_beta_20260728_003",
        "run_live_qwen37plus_full60_beta_20260728_004",
        "run_live_qwen37plus_full60_beta_prompt15_20260728_012",
        "run_live_qwen37plus_full60_beta_prompt16_20260728_013"
      ],
      "prompt_versions": [
        "1.0.0",
        "1.5.0",
        "1.6.0"
      ],
      "first_seen_at": "2026-07-28T07:33:55.836Z",
      "last_seen_at": "2026-07-28T08:52:13.277Z",
      "unseen_eligible": false
    },
    {
      "asset_id": "photo-v1-difficult-005",
      "dataset_split": "training",
      "source_url": "https://commons.wikimedia.org/wiki/File:D%C3%BClmen,_Viktorkirmes_auf_dem_Overbergplatz_--_2014_--_3738.jpg",
      "content_hash": "sha256:f6bc9c030cd98e9898388c570bcb39e96500cca03b13aa473e3d1ff7e2a894af",
      "selected_exposed": true,
      "provider_exposed": false,
      "live_completed": false,
      "mock_seen": false,
      "potential_iteration_influence": false,
      "run_ids": [
        "run_live_qwen37plus_full60_beta_20260728_001",
        "run_live_qwen37plus_full60_beta_20260728_002",
        "run_live_qwen37plus_full60_beta_20260728_003",
        "run_live_qwen37plus_full60_beta_20260728_004",
        "run_live_qwen37plus_full60_beta_prompt15_20260728_012",
        "run_live_qwen37plus_full60_beta_prompt16_20260728_013"
      ],
      "prompt_versions": [
        "1.0.0",
        "1.5.0",
        "1.6.0"
      ],
      "first_seen_at": "2026-07-28T07:33:55.836Z",
      "last_seen_at": "2026-07-28T08:52:13.277Z",
      "unseen_eligible": false
    },
    {
      "asset_id": "photo-v1-difficult-006",
      "dataset_split": "training",
      "source_url": "https://commons.wikimedia.org/wiki/File:Folkloric_Tanoura_dance_performed_by_man.jpg",
      "content_hash": "sha256:42a31676ecd05cfbcf05726eafe22191a5cffdc081ae3932b2675dce1d498711",
      "selected_exposed": true,
      "provider_exposed": false,
      "live_completed": false,
      "mock_seen": false,
      "potential_iteration_influence": false,
      "run_ids": [
        "run_live_qwen37plus_full60_beta_20260728_001",
        "run_live_qwen37plus_full60_beta_20260728_002",
        "run_live_qwen37plus_full60_beta_20260728_003",
        "run_live_qwen37plus_full60_beta_20260728_004",
        "run_live_qwen37plus_full60_beta_prompt15_20260728_012",
        "run_live_qwen37plus_full60_beta_prompt16_20260728_013"
      ],
      "prompt_versions": [
        "1.0.0",
        "1.5.0",
        "1.6.0"
      ],
      "first_seen_at": "2026-07-28T07:33:55.836Z",
      "last_seen_at": "2026-07-28T08:52:13.277Z",
      "unseen_eligible": false
    },
    {
      "asset_id": "photo-v1-difficult-007",
      "dataset_split": "regression",
      "source_url": "https://commons.wikimedia.org/wiki/File:Low-key_photograph_of_light_bulb,_Straume,_Norway_julesvernex2.jpg",
      "content_hash": "sha256:af15c527bde90ba42c3547488a716a89e3e40c7c25f719d71a65b03a5a6a6c85",
      "selected_exposed": true,
      "provider_exposed": false,
      "live_completed": false,
      "mock_seen": false,
      "potential_iteration_influence": false,
      "run_ids": [
        "run_live_qwen37plus_full60_beta_20260728_001",
        "run_live_qwen37plus_full60_beta_20260728_002",
        "run_live_qwen37plus_full60_beta_20260728_003",
        "run_live_qwen37plus_full60_beta_20260728_004",
        "run_live_qwen37plus_full60_beta_prompt15_20260728_012",
        "run_live_qwen37plus_full60_beta_prompt16_20260728_013"
      ],
      "prompt_versions": [
        "1.0.0",
        "1.5.0",
        "1.6.0"
      ],
      "first_seen_at": "2026-07-28T07:33:55.836Z",
      "last_seen_at": "2026-07-28T08:52:13.277Z",
      "unseen_eligible": false
    },
    {
      "asset_id": "photo-v1-difficult-008",
      "dataset_split": "regression",
      "source_url": "https://commons.wikimedia.org/wiki/File:Low_Light_-_geograph.org.uk_-_2592063.jpg",
      "content_hash": "sha256:c7fee8e630c3843034d2be4c62c6e90aeb66a87415d312d447d073829a0d86a4",
      "selected_exposed": true,
      "provider_exposed": false,
      "live_completed": false,
      "mock_seen": false,
      "potential_iteration_influence": false,
      "run_ids": [
        "run_live_qwen37plus_full60_beta_20260728_001",
        "run_live_qwen37plus_full60_beta_20260728_002",
        "run_live_qwen37plus_full60_beta_20260728_003",
        "run_live_qwen37plus_full60_beta_20260728_004",
        "run_live_qwen37plus_full60_beta_prompt15_20260728_012",
        "run_live_qwen37plus_full60_beta_prompt16_20260728_013"
      ],
      "prompt_versions": [
        "1.0.0",
        "1.5.0",
        "1.6.0"
      ],
      "first_seen_at": "2026-07-28T07:33:55.836Z",
      "last_seen_at": "2026-07-28T08:52:13.277Z",
      "unseen_eligible": false
    },
    {
      "asset_id": "photo-v1-difficult-009",
      "dataset_split": "holdout",
      "source_url": "https://commons.wikimedia.org/wiki/File:Four_versions_of_a_floodlight_through_rain_on_a_window.jpg",
      "content_hash": "sha256:ac637e54f017dac6541aa5145be00639c2636293e93383b5b946369a1e9d45e6",
      "selected_exposed": true,
      "provider_exposed": true,
      "live_completed": true,
      "mock_seen": false,
      "potential_iteration_influence": true,
      "run_ids": [
        "run_live_qwen37plus_full60_beta_20260728_001",
        "run_live_qwen37plus_full60_beta_20260728_002",
        "run_live_qwen37plus_full60_beta_20260728_003",
        "run_live_qwen37plus_full60_beta_20260728_004",
        "run_live_qwen37plus_full60_beta_prompt15_20260728_012",
        "run_live_qwen37plus_full60_beta_prompt16_20260728_013",
        "run_live_qwen37plus_smoke_20260727_001",